platform,topic,content,toxic,toxic_one_hot,toxic_type,toxic_type_one_hot,expression,expression_one_hot,target,length,label
zhihu,region,我还真的信，河南那一圈，因为河南黄河被绝口，河南人四面都有逃难，所以，陕西河北山东山西都有黑，现在陕西是主力了，因为两省利益问题，河北和河南口音不仔细注意着，可能分不清，就像我以前一直以为王宝强是我们河南的😅，山西以前也是有钱，现在老实了，山东和河南关系一直说还行吧，现在经济北方老大和老二，安徽关系算是最好，特别是皖北，湖北因为两个省会原因，也是互骂的厉害,1,"[0, 1]",2,"[0, 1]",3,"[0, 0, 1]","[0, 1, 0, 0, 0]",182,hateful
zhihu,lgbt,是的。这个观点🉑,0,"[1, 0]",0,"[0, 0]",0,"[0, 0, 0]","[0, 0, 0, 0, 0]",8,non-hateful
tieba,lgbt,他对妻子不负责任，像陌生人，对孩子很好；,1,"[0, 1]",2,"[0, 1]",3,"[0, 0, 1]","[0, 1, 0, 0, 0]",20,hateful
tieba,gender,她们又想刀谁去爆金币了吗,1,"[0, 1]",2,"[0, 1]",2,"[0, 1, 0]","[0, 0, 1, 0, 0]",12,hateful
zhihu,region,说真的我在部队黑河南人最多的是河北人🤣,1,"[0, 1]",2,"[0, 1]",3,"[0, 0, 1]","[0, 1, 0, 0, 0]",23,hateful
tieba,gender,这篇文章简单提及了日本和韩国女权,0,"[1, 0]",0,"[0, 0]",0,"[0, 0, 0]","[0, 0, 0, 0, 0]",16,non-hateful
tieba,race,现在还发文章吗,0,"[1, 0]",0,"[0, 0]",0,"[0, 0, 0]","[0, 0, 0, 0, 0]",7,non-hateful
tieba,gender,不过专车比其他确实贵几赔,0,"[1, 0]",0,"[0, 0]",0,"[0, 0, 0]","[0, 0, 0, 0, 0]",12,non-hateful
zhihu,region,除了东北上海河南其他地方真不叫黑,1,"[0, 1]",2,"[0, 1]",3,"[0, 0, 1]","[0, 1, 0, 0, 0]",16,hateful
zhihu,race,第一还听说用传播范围定罪有无的，传播范围小就无罪了？再说艾滋病男传女的几率要大于女传男哦。,0,"[1, 0]",0,"[0, 0]",0,"[0, 0, 0]","[0, 0, 0, 0, 0]",45,non-hateful
tieba,gender,国女都是一群情绪化的**，觉得全世界都得让着她不能惹她,1,"[0, 1]",2,"[0, 1]",1,"[1, 0, 0]","[0, 0, 1, 0, 0]",27,hateful
tieba,race,动听悦耳，天籁之音,0,"[1, 0]",0,"[0, 0]",0,"[0, 0, 0]","[0, 0, 0, 0, 0]",9,non-hateful
zhihu,region,有100多万个小偷骗子？,0,"[1, 0]",0,"[0, 0]",0,"[0, 0, 0]","[0, 0, 0, 0, 0]",12,non-hateful
tieba,lgbt,同性恋应该选中立至少不会出来恶心人，同性恋者选中立做深柜才有可能改邪归正,1,"[0, 1]",2,"[0, 1]",1,"[1, 0, 0]","[1, 0, 0, 0, 0]",36,hateful
zhihu,race,看到你把国外贬低中国女性的水文当成圣经，应该有很多人也就放心了😆,1,"[0, 1]",2,"[0, 1]",2,"[0, 1, 0]","[0, 0, 1, 0, 0]",35,hateful
zhihu,race,看你其他答案被举报了，到这里来补个赞,0,"[1, 0]",0,"[0, 0]",0,"[0, 0, 0]","[0, 0, 0, 0, 0]",18,non-hateful
zhihu,race,easy girl懂？无缘无故扣这个帽子？崇媚洋外中国好像很普遍，某些大学一年十几万几十万请连汉字都不认识多少的“高材生”？国内211随便挑几个会比这种人差？,1,"[0, 1]",2,"[0, 1]",1,"[1, 0, 0]","[0, 0, 1, 1, 0]",79,hateful
zhihu,region,北方人被南方人叫侉子,1,"[0, 1]",2,"[0, 1]",3,"[0, 0, 1]","[0, 1, 0, 0, 0]",10,hateful
zhihu,race,混血儿过去不是叫杂种么,1,"[0, 1]",2,"[0, 1]",1,"[1, 0, 0]","[0, 0, 0, 1, 0]",11,hateful
tieba,race,你可以取消“粉丝”啊,0,"[1, 0]",0,"[0, 0]",0,"[0, 0, 0]","[0, 0, 0, 0, 0]",10,non-hateful
zhihu,region,以偏概全了，什么叫底层人的思维，地位低就必须鼠目寸光吗。就是剥削者，小老板 一样有地域偏见的。嘲讽别人的刻板印象自己却也在偏见，我还见过读过大学的老人一样在捡垃圾呢。什么样的思维看人的想思不是看地位。,1,"[0, 1]",2,"[0, 1]",3,"[0, 0, 1]","[0, 1, 0, 0, 0]",100,hateful
zhihu,lgbt,hai 你不也是？至于吗 人家就说不支持 扯出这么多话 而且你的话道德绑架也太厉害了逻辑也不对 在网上这样评论有什么问题吗 为什么一定牵扯到现实生活 这么说那先评论反对的都是现实中被压迫？？,1,"[0, 1]",2,"[0, 1]",3,"[0, 0, 1]","[0, 0, 0, 0, 1]",95,hateful
zhihu,region,这要再加上在山大当过学伴，buff就叠满了,1,"[0, 1]",2,"[0, 1]",3,"[0, 0, 1]","[0, 1, 0, 0, 0]",21,hateful
tieba,lgbt,如题。。。。。。,0,"[1, 0]",0,"[0, 0]",0,"[0, 0, 0]","[0, 0, 0, 0, 0]",8,non-hateful
zhihu,race,好家伙，忘了我呢？,0,"[1, 0]",0,"[0, 0]",0,"[0, 0, 0]","[0, 0, 0, 0, 0]",9,non-hateful
zhihu,race,但是你的问题本身也是在外娶范畴里的，我说外娶数据本身也没问题啊。你想说的不就是男人娶了也去非洲吗？那我告诉你，与非洲女性维持婚姻关系的男性，基本都是在当地的华企员工，且基本都在当地国家登记。你还有什么问题吗？,0,"[1, 0]",0,"[0, 0]",0,"[0, 0, 0]","[0, 0, 0, 0, 0]",104,non-hateful
tieba,gender,计划生育80年代发生的。我们这大概70年代末（乡下）。所以我们这80-90几乎都是独生子女，不论城市还是乡下。我同学里有兄弟姐妹的屈指可数。这里是东部沿海，如今当地人口稀少，本地人特别少。分配财产子女都有份。我父母那代就不存在重男轻女（他们60后），也不存在全职太太。所以中国很大，很多事情我是成年后到其他地方才知道是真的。所以也意识到好像女拳打的世界和我认知的不太一样。她们或真的生在水深火热，或只是根据别人的经历打拳。,0,"[1, 0]",0,"[0, 0]",0,"[0, 0, 0]","[0, 0, 0, 0, 0]",211,non-hateful
zhihu,race,我不歧视黑人，但是我歧视媚黑的人。,0,"[1, 0]",0,"[0, 0]",0,"[0, 0, 0]","[0, 0, 0, 0, 0]",17,non-hateful
tieba,gender,大家可以多混混黑界和喷系，学学滚刀词汇，练练打字速度。也最好多了解学习一下语言学，逻辑学，辩论学，这些可以帮助大家出征仇男雌教魔怔教徒更添一笔整体战斗力和攻击值！,1,"[0, 1]",2,"[0, 1]",1,"[1, 0, 0]","[0, 0, 1, 0, 0]",81,hateful
tieba,lgbt,txl和yxl都进来看看，给你们看一个双面人,0,"[1, 0]",0,"[0, 0]",0,"[0, 0, 0]","[0, 0, 0, 0, 0]",22,non-hateful
tieba,race,一个可爱一个丑,0,"[1, 0]",0,"[0, 0]",0,"[0, 0, 0]","[0, 0, 0, 0, 0]",7,non-hateful
zhihu,race,一位优秀的接盘侠👍👍,1,"[0, 1]",1,"[1, 0]",0,"[0, 0, 0]","[0, 0, 0, 0, 0]",14,hateful
zhihu,region,🐶快把陕西也算上，现在轮到陕西了，西北也快沦陷了,0,"[1, 0]",0,"[0, 0]",0,"[0, 0, 0]","[0, 0, 0, 0, 0]",29,non-hateful
zhihu,region,东北感谢唐山以前说黑社会联想地名绝对是东北 现在可是唐山了,1,"[0, 1]",2,"[0, 1]",2,"[0, 1, 0]","[0, 1, 0, 0, 0]",29,hateful
zhihu,race,单亲，带黑娃，怎么也会被人说的，被人疏远的。就因为这个黑娃，她这辈子是没了，这黑娃还要上她的户口，到时候这黑娃在中国生活也会很艰难的。,1,"[0, 1]",2,"[0, 1]",3,"[0, 0, 1]","[0, 0, 1, 1, 0]",67,hateful
tieba,race,右边的小老头就是婊们口中的所谓“高端白人脸”，和我们的胡兵一比，被秒成渣渣，何况是胡兵比这个小老头还大好几岁！！！！还比他皮肤白,1,"[0, 1]",2,"[0, 1]",2,"[0, 1, 0]","[0, 0, 0, 1, 0]",64,hateful
tieba,race,搞不懂这些人看母猩猩能有情欲？,1,"[0, 1]",2,"[0, 1]",1,"[1, 0, 0]","[0, 0, 0, 1, 0]",15,hateful
zhihu,region,麻烦你下回举证用：江桥抗战，国际公认反法西斯战争第一枪！,0,"[1, 0]",0,"[0, 0]",0,"[0, 0, 0]","[0, 0, 0, 0, 0]",28,non-hateful
zhihu,lgbt,同性恋又没触犯法律国家当然不管也管不了总不能抓起来吧，既然管不了干脆不管了反正又不影响社会稳定，不是国家认可，是国家不管。国家不在乎。,0,"[1, 0]",0,"[0, 0]",0,"[0, 0, 0]","[0, 0, 0, 0, 0]",67,non-hateful
tieba,gender,其实根本不用那么难，韩女喜欢南亚男性荷尔蒙！但是想控制韩女的自由是不可能是，那些个大胡子也不会威逼，知道得了便宜差不多得了！,1,"[0, 1]",2,"[0, 1]",2,"[0, 1, 0]","[0, 1, 0, 0, 0]",62,hateful
tieba,race,哈哈，吃饱狗肉就溜了？,1,"[0, 1]",1,"[1, 0]",0,"[0, 0, 0]","[0, 0, 0, 0, 0]",11,hateful
zhihu,lgbt,有时候说自己不喜欢同性恋就要被骂，又没碍着他们，非要所有人都举双手双脚支持是不是？是不是连自己的思想自由都没有了？,1,"[0, 1]",2,"[0, 1]",1,"[1, 0, 0]","[1, 0, 0, 0, 0]",57,hateful
tieba,race,别买，这是设计给黑人穿的,1,"[0, 1]",2,"[0, 1]",2,"[0, 1, 0]","[0, 0, 0, 1, 0]",12,hateful
zhihu,race,宁愿娶二婚也绝对不要跟黑人在一起过的。,1,"[0, 1]",2,"[0, 1]",1,"[1, 0, 0]","[0, 0, 1, 1, 0]",19,hateful
tieba,lgbt,放屁的时候还会用手把屁罩住，然后放在同学鼻子前把手松开，然后同学就会闻到屁味，这是我独家发明的整人招数，然后我同学也会这样报复我。我还会把头皮屑挠出一桌子，然后包在纸里送给女同学，然后看她们嫌弃的反应特别好玩。后来毕业的时候发现被我整得最多的女同桌原来一直暗恋我,0,"[1, 0]",0,"[0, 0]",0,"[0, 0, 0]","[0, 0, 0, 0, 0]",131,non-hateful
zhihu,race,万分之九？这么高的吗？我这十几万人的小镇，按比例有100人？不寒而栗啊😱,0,"[1, 0]",0,"[0, 0]",0,"[0, 0, 0]","[0, 0, 0, 0, 0]",39,non-hateful
tieba,gender,微博傻卵玩意废物木人是这样的,1,"[0, 1]",2,"[0, 1]",1,"[1, 0, 0]","[0, 0, 1, 0, 0]",14,hateful
tieba,lgbt,黄字弹幕味太冲了。,0,"[1, 0]",0,"[0, 0]",0,"[0, 0, 0]","[0, 0, 0, 0, 0]",9,non-hateful
tieba,gender,不然幕刃是怎么诞生的？,1,"[0, 1]",2,"[0, 1]",1,"[1, 0, 0]","[0, 0, 1, 0, 0]",11,hateful
tieba,lgbt,我不相信同性能改变性取向,1,"[0, 1]",2,"[0, 1]",2,"[0, 1, 0]","[1, 0, 0, 0, 0]",12,hateful
tieba,gender,反正我不结婚了，这辈子就这样吧,0,"[1, 0]",0,"[0, 0]",0,"[0, 0, 0]","[0, 0, 0, 0, 0]",15,non-hateful
tieba,gender,在国外，要配偶工资上交是家暴,0,"[1, 0]",0,"[0, 0]",0,"[0, 0, 0]","[0, 0, 0, 0, 0]",14,non-hateful
tieba,gender,这个问题得和社会资源充不充足来配套看，社会资源充足就导致个体女人产生了不需要个体男人的错觉，社会资源不充足（贫困战乱时期）大家都顾着自己呢，谁在乎女人咋样。温饱思淫欲，动保环保女权这类东西的发展，必须建立在一个稳定/处于上升期的社会,1,"[0, 1]",2,"[0, 1]",1,"[1, 0, 0]","[0, 0, 1, 0, 0]",116,hateful
zhihu,region,我们已经被黑好多年了，现在河南人一和别人争论，别人就会说不愧是名声在外的河南人，几年前抗日剧很普遍时，还经常有把河南踢给日本的言论，，,1,"[0, 1]",2,"[0, 1]",3,"[0, 0, 1]","[0, 1, 0, 0, 0]",67,hateful
tieba,race,黑化的法国也完蛋了,1,"[0, 1]",2,"[0, 1]",1,"[1, 0, 0]","[0, 1, 0, 1, 0]",9,hateful
zhihu,lgbt,我觉得我也思想有点问题，是个女生双性恋，但是我觉得女女可接受（因为我也是）但是我觉得男男有点ex???我一度怀疑自己是不是毛病...明明自己也是被这个世界不认可的人居然会有这种思想，真的很不好意思,1,"[0, 1]",2,"[0, 1]",1,"[1, 0, 0]","[1, 0, 1, 0, 0]",98,hateful
tieba,lgbt,一定是因为偷窥男子的妻子是骗婚女同他才会这样的,1,"[0, 1]",2,"[0, 1]",2,"[0, 1, 0]","[1, 0, 1, 0, 0]",23,hateful
tieba,race,超过西周？？？我说是放P。西周早就发明文字了，黑人什么时候有过文字？到现在还有原始社会。,1,"[0, 1]",2,"[0, 1]",1,"[1, 0, 0]","[0, 0, 0, 1, 0]",44,hateful
tieba,gender,她们才是普信女,1,"[0, 1]",2,"[0, 1]",1,"[1, 0, 0]","[0, 0, 1, 0, 0]",7,hateful
zhihu,race,谁是敌人，谁是朋友是革命的首要问题。,0,"[1, 0]",0,"[0, 0]",0,"[0, 0, 0]","[0, 0, 0, 0, 0]",18,non-hateful
zhihu,race,还是缺物质的女人太多。,1,"[0, 1]",2,"[0, 1]",2,"[0, 1, 0]","[0, 0, 1, 0, 0]",11,hateful
zhihu,lgbt,那也不一定，只是说直男默认你是直男，所以在涉及这些话题的时候会象征性地跟随一下“大流”罢了，要真说直男有多讨厌弯男，我没怎么觉得，没影响到自己基本上都无所谓，一会儿甚至就忘了,0,"[1, 0]",0,"[0, 0]",0,"[0, 0, 0]","[0, 0, 0, 0, 0]",87,non-hateful
tieba,gender,过失杀人，20年以上，限制缓刑，最好死刑立即执行,0,"[1, 0]",0,"[0, 0]",0,"[0, 0, 0]","[0, 0, 0, 0, 0]",24,non-hateful
tieba,race,就这货现在是以中华田园犬和萌宠见闻和夹你和hefggdΩ和众多小号出现在各大平台里,1,"[0, 1]",1,"[1, 0]",0,"[0, 0, 0]","[0, 0, 0, 0, 0]",41,hateful
zhihu,region,人类祖先还是非洲呢？这能说明什么？,0,"[1, 0]",0,"[0, 0]",0,"[0, 0, 0]","[0, 0, 0, 0, 0]",17,non-hateful
zhihu,region,日本民族南迁江苏大融合😢被侵略了就用大融合自我安慰，和汪精卫有什么区别？,0,"[1, 0]",0,"[0, 0]",0,"[0, 0, 0]","[0, 0, 0, 0, 0]",39,non-hateful
zhihu,lgbt,我觉得很恶心啊，这是心里表现，但是我不会侮辱他们啊，但是我会侮辱宣传txl的，而且是狠狠的侮辱😄,1,"[0, 1]",2,"[0, 1]",1,"[1, 0, 0]","[1, 0, 0, 0, 0]",51,hateful
tieba,gender,装成女人来骗那群龟男来舔啊，这就是最简单的方法了,1,"[0, 1]",2,"[0, 1]",1,"[1, 0, 0]","[0, 0, 1, 0, 0]",24,hateful
zhihu,race,你妈确实不如你姐,0,"[1, 0]",0,"[0, 0]",0,"[0, 0, 0]","[0, 0, 0, 0, 0]",8,non-hateful
tieba,gender,这我该怎么回呢？,0,"[1, 0]",0,"[0, 0]",0,"[0, 0, 0]","[0, 0, 0, 0, 0]",8,non-hateful
zhihu,region,可怜之人必有可恨之处,0,"[1, 0]",0,"[0, 0]",0,"[0, 0, 0]","[0, 0, 0, 0, 0]",10,non-hateful
zhihu,race,y染色体啊，囧,0,"[1, 0]",0,"[0, 0]",0,"[0, 0, 0]","[0, 0, 0, 0, 0]",10,non-hateful
zhihu,region,其实这样反而挺好的，要是做出什么大动作，做得好也会被恨国党黑，还不如平平淡淡😅,0,"[1, 0]",0,"[0, 0]",0,"[0, 0, 0]","[0, 0, 0, 0, 0]",42,non-hateful
zhihu,region,八国洋人在天津消灭了九成天津人，天津貌似没有被毁灭啊,0,"[1, 0]",0,"[0, 0]",0,"[0, 0, 0]","[0, 0, 0, 0, 0]",26,non-hateful
zhihu,race,瞎说，去非洲感受一下才有发言权，这答主都没去过非洲肯定瞎说的，你要相信自己，一定要自己去感受一下才行😎,0,"[1, 0]",0,"[0, 0]",0,"[0, 0, 0]","[0, 0, 0, 0, 0]",53,non-hateful
zhihu,race,新闻报导黑人男人单枪匹马在广州地铁徒手当众暴揍南方男人，一车南方男人没一人帮忙，新闻常报导东北人在海南街头当众暴揍海南男人，满街海南男人看着海南同胞被外地人当众痛打没一人帮忙,0,"[1, 0]",0,"[0, 0]",0,"[0, 0, 0]","[0, 0, 0, 0, 0]",87,non-hateful
zhihu,race,有了钱和地位，就更管不住下半身了。🙄,1,"[0, 1]",2,"[0, 1]",2,"[0, 1, 0]","[0, 0, 1, 0, 0]",21,hateful
zhihu,lgbt,就是 我这边 以前有个男同专门杀同性恋的 说是被他们那个群体逼成这样的,1,"[0, 1]",2,"[0, 1]",3,"[0, 0, 1]","[1, 0, 0, 0, 0]",35,hateful
tieba,gender,也就是有钱的闲蛋才需要。,1,"[0, 1]",1,"[1, 0]",0,"[0, 0, 0]","[0, 0, 0, 0, 0]",12,hateful
tieba,gender,中华人民共和国都没有反对女权，支持女权。所以她的說的对,0,"[1, 0]",0,"[0, 0]",0,"[0, 0, 0]","[0, 0, 0, 0, 0]",27,non-hateful
zhihu,lgbt,是不是穷人家因为家徒四壁就不应该设置防盗门了。同性恋是贼穷人家也是人，不管怎么都应该提防变态基佬,1,"[0, 1]",2,"[0, 1]",1,"[1, 0, 0]","[1, 0, 0, 0, 0]",48,hateful
zhihu,region,跟这个没关系，主要是80年代，河南是全国小偷各地集团的汇聚中心，因为当时铁路为主，而河南是全国铁路交汇的枢纽，小偷最多，导致河南名声被连累，,0,"[1, 0]",0,"[0, 0]",0,"[0, 0, 0]","[0, 0, 0, 0, 0]",70,non-hateful
zhihu,race,拿个例出来说有意思？我在现实中看到的媚黑女就一个，黑人我见了有几十个，确实大部分女生根本看不上黑人啊，楼主说的哪里有毛病？还有那三陪一是政策问题吧,1,"[0, 1]",2,"[0, 1]",1,"[1, 0, 0]","[0, 0, 1, 1, 0]",73,hateful
tieba,gender,你以为自己很聪明吗？这就好比你要让农民觉醒，不去走进群众，反而当起地主来。你的这套玩意漏洞百出下作至极，快爬吧,1,"[0, 1]",1,"[1, 0]",0,"[0, 0, 0]","[0, 0, 0, 0, 0]",55,hateful
tieba,race,别想多了，有多少中国女性会嫁黑人？反正我从来没遇见到过。在者，你会娶精黑女？。,1,"[0, 1]",2,"[0, 1]",2,"[0, 1, 0]","[0, 0, 1, 1, 0]",39,hateful
zhihu,race,瞅那些脑子不正常的人干嘛啊？让自己生气多不值得啊,1,"[0, 1]",1,"[1, 0]",0,"[0, 0, 0]","[0, 0, 0, 0, 0]",24,hateful
zhihu,race,可能还倒贴钱🤣,0,"[1, 0]",0,"[0, 0]",0,"[0, 0, 0]","[0, 0, 0, 0, 0]",11,non-hateful
zhihu,race,默默太恶心了，受不了😱,1,"[0, 1]",2,"[0, 1]",1,"[1, 0, 0]","[0, 0, 0, 1, 0]",11,hateful
zhihu,race,哀其不幸，怒其不争，这男的真该，头顶绿得发黑了还原谅呢，别人劝了不听，自食其果，还发在网上…无语,1,"[0, 1]",1,"[1, 0]",0,"[0, 0, 0]","[0, 0, 0, 0, 0]",48,hateful
tieba,gender,这有啥，一人一个巴掌完事,1,"[0, 1]",1,"[1, 0]",0,"[0, 0, 0]","[0, 0, 0, 0, 0]",12,hateful
zhihu,race,非洲人以家暴为荣，女人地位比驴都低，婚外约pao，养不起家的就直接跑路，艾滋率1/3。在漂亮国黑人人口占15%，却贡献了55%的犯罪事件。这种高级人才才配得上那些小仙女，而且我们没有嫁了人还留娘家的习惯，快去非洲追求真爱吧,1,"[0, 1]",2,"[0, 1]",1,"[1, 0, 0]","[0, 0, 1, 1, 1]",111,hateful
zhihu,region,陕西人是这样的😄,0,"[1, 0]",0,"[0, 0]",0,"[0, 0, 0]","[0, 0, 0, 0, 0]",11,non-hateful
tieba,race,看到黑人吧三观这么正我就放心了,1,"[0, 1]",2,"[0, 1]",2,"[0, 1, 0]","[0, 0, 0, 1, 0]",15,hateful
tieba,race,转：非洲分为撒哈拉地区和撒哈拉南的地区。撒哈拉地区很早就脱离了原始文明了，早期有埃及文明以及后来的腓尼基人，后来该地区又先后成为了亚历山大马其顿帝国，罗马共和国帝国，阿拉伯帝国，奥斯曼帝国的领土，近代时受到欧洲势力的殖民或半殖民，直到近几十年纷纷独立为现在的一个个国家。撒哈拉以南的黑非洲地区，长期处于部落或部落联盟的文明水平，没有成型的系统的文字，没有国家民族概念的形成，直到几百年前被西方殖民者入侵，才接触的现代文明，最终有了民族的概念，后来被西方殖民后在近几十年独立后产生了现代的国家。黑人多数是南非洲，几百年前是部落文明，原始社会，没有文字。没有历史北非洲很少黑人，黄种人白种人有历史，有文明,0,"[1, 0]",0,"[0, 0]",0,"[0, 0, 0]","[0, 0, 0, 0, 0]",300,non-hateful
zhihu,race,父母都不管的，谁吃了咸菜淡操心，爱咋咋地,1,"[0, 1]",1,"[1, 0]",0,"[0, 0, 0]","[0, 0, 0, 0, 0]",20,hateful
zhihu,race,得不得病我不知道，反正狐臭遗传没跑了🤣，估计在中国他的味道肯定会很受欢迎吧,1,"[0, 1]",2,"[0, 1]",1,"[1, 0, 0]","[0, 0, 0, 1, 0]",41,hateful
tieba,gender,万一它们是体重两百的坦克呢？当然不输普通男性。一般100斤左右的力气是比不过一般男性的。,1,"[0, 1]",2,"[0, 1]",1,"[1, 0, 0]","[0, 0, 1, 0, 0]",44,hateful
zhihu,race,找了个帅的白人，再找个丑的国人。然后放在一起比较，说中国男人就是比欧美男人丑，有意思吗？,1,"[0, 1]",2,"[0, 1]",3,"[0, 0, 1]","[0, 0, 1, 0, 0]",44,hateful
zhihu,race,歧视又怎么样，我们压根不欠他们黑人什么。,1,"[0, 1]",2,"[0, 1]",1,"[1, 0, 0]","[0, 0, 0, 1, 0]",20,hateful
tieba,gender,你想穿没人管你啊，没人干涉你的,0,"[1, 0]",0,"[0, 0]",0,"[0, 0, 0]","[0, 0, 0, 0, 0]",15,non-hateful
tieba,gender,看看喷吧被删的贴子捏,0,"[1, 0]",0,"[0, 0]",0,"[0, 0, 0]","[0, 0, 0, 0, 0]",10,non-hateful
tieba,race,驻日美军的后代,0,"[1, 0]",0,"[0, 0]",0,"[0, 0, 0]","[0, 0, 0, 0, 0]",7,non-hateful
tieba,race,哈哈是啊我还记得在香港重庆大厦那些各种好闻的香料和难闻的体味混杂让人恍惚到了伊斯坦布尔的经历，，，不得不承认上帝造人太公平，让印巴人种有深潭一样美丽的眼睛和脸部轮廓但就是不能让人近身，，，，，,1,"[0, 1]",2,"[0, 1]",2,"[0, 1, 0]","[0, 0, 0, 1, 0]",96,hateful
zhihu,race,黑人要在中国呆，就得把皮拔了，染成黄色的,1,"[0, 1]",2,"[0, 1]",1,"[1, 0, 0]","[0, 0, 0, 1, 0]",20,hateful
tieba,gender,拳师攻占大学，目的是把男性排挤出高等教育，从而坐稳高位,1,"[0, 1]",2,"[0, 1]",2,"[0, 1, 0]","[0, 0, 1, 0, 0]",27,hateful
zhihu,region,可能是打s土匪路霸有奖，90年代持枪倒爷、抢火车肯定有啊,0,"[1, 0]",0,"[0, 0]",0,"[0, 0, 0]","[0, 0, 0, 0, 0]",28,non-hateful
zhihu,lgbt,就凭人家懂得共情,0,"[1, 0]",0,"[0, 0]",0,"[0, 0, 0]","[0, 0, 0, 0, 0]",8,non-hateful
tieba,race,这个♂的是嘿杂吗,1,"[0, 1]",2,"[0, 1]",1,"[1, 0, 0]","[0, 0, 0, 1, 0]",8,hateful
zhihu,race,吴施蒙事件，她前夫张哥也不知道是祖上造了什么孽，好好的结个婚，就一顶顶黑帽戴得天下皆知，闻名遐迩。最后离婚了失业了抑郁了,1,"[0, 1]",2,"[0, 1]",2,"[0, 1, 0]","[0, 0, 1, 1, 0]",60,hateful
tieba,race,你搁这发鬼图呢？,1,"[0, 1]",1,"[1, 0]",0,"[0, 0, 0]","[0, 0, 0, 0, 0]",8,hateful
tieba,race,南非从来都不是发达国家，从哪个维度来看都是社会问题极为严重的发展中国家，只不过南非借了指标计算方法的空子，一度让自己的人均GDP到达了发达国家的标准。换句话来说，白人政府造假。,1,"[0, 1]",2,"[0, 1]",1,"[1, 0, 0]","[0, 1, 0, 0, 0]",88,hateful
tieba,lgbt,无可救药之人不需要改变，艾滋中自生自灭,1,"[0, 1]",2,"[0, 1]",1,"[1, 0, 0]","[0, 0, 0, 0, 1]",19,hateful
zhihu,lgbt,很多女生受腐漫、纯爱小说的影响去掰弯直男，真的。。。。吃饱了撑的,1,"[0, 1]",2,"[0, 1]",1,"[1, 0, 0]","[0, 0, 1, 0, 0]",32,hateful
zhihu,race,什么玩意儿。反正我身边的漂亮女同学都跟我玩儿得挺好的，也都很有素质，我也没见过什么乱七八糟的女拳行为啊。少上网，各位。,0,"[1, 0]",0,"[0, 0]",0,"[0, 0, 0]","[0, 0, 0, 0, 0]",59,non-hateful
zhihu,race,鲜卑人还有记录吗？早同化了OK？,0,"[1, 0]",0,"[0, 0]",0,"[0, 0, 0]","[0, 0, 0, 0, 0]",16,non-hateful
zhihu,lgbt,有些gay努力奋斗却依然挣扎在追求自己美好生活的路上，为了顾及多病的父母，用终身不婚的单身贵族形象搪塞了家人，为了找到愿意安安稳稳过日子的那个他，从不约p，被同为gay的圈内人说成是表面圣母白莲花私底下放荡的伪纯洁，被异性恋朋友说成长不大要求高不现实的大龄单身狗，我们活着好难，这时候如果有一个人跟我说朋友我不反对你找同性，但是我恶心你们，我可能不会多生你的气，但我肯定高兴不到哪儿去。,1,"[0, 1]",2,"[0, 1]",3,"[0, 0, 1]","[1, 0, 0, 0, 0]",193,hateful
tieba,lgbt,人和低等动物不一样，低等到行为只受基因和本能控制，人是高等动物，有着复杂的情感思维意识，人的行为更大程度上是受后天因素影响，这就好比吸烟喝酒上瘾就很难戒掉，这跟基因无关，只是需要毅力来克服，自我愿不愿意去改变，而非不能改变,0,"[1, 0]",0,"[0, 0]",0,"[0, 0, 0]","[0, 0, 0, 0, 0]",111,non-hateful
zhihu,race,为什么我觉得世界女权是在故意抹黑中国女性呢？中国女性中真正的口区女权比例不大吧？为什么要所有中国女性背锅,1,"[0, 1]",2,"[0, 1]",3,"[0, 0, 1]","[0, 0, 0, 1, 0]",52,hateful
tieba,race,"""666,中日韩的成绩比白人高。""",0,"[1, 0]",0,"[0, 0]",0,"[0, 0, 0]","[0, 0, 0, 0, 0]",17,non-hateful
zhihu,race,长得越漂亮越觉得恶心,1,"[0, 1]",1,"[1, 0]",0,"[0, 0, 0]","[0, 0, 0, 0, 0]",10,hateful
zhihu,race,你竟然不知道人类早就爱情不分物种了。你以为羊是用来干什么的？,0,"[1, 0]",0,"[0, 0]",0,"[0, 0, 0]","[0, 0, 0, 0, 0]",30,non-hateful
zhihu,lgbt,你长得帅的话这个回答就攻击不到你啦,0,"[1, 0]",0,"[0, 0]",0,"[0, 0, 0]","[0, 0, 0, 0, 0]",17,non-hateful
tieba,lgbt,有没有肌肉男来交傻我,1,"[0, 1]",2,"[0, 1]",2,"[0, 1, 0]","[1, 0, 0, 0, 0]",10,hateful
tieba,gender,吧友们帮我骂个慕女狗，打女拳的狗男硬是想被幕刃当狗玩，真丢脸,1,"[0, 1]",2,"[0, 1]",1,"[1, 0, 0]","[0, 0, 1, 0, 0]",30,hateful
zhihu,race,没必要问原因，因为那不重要。,0,"[1, 0]",0,"[0, 0]",0,"[0, 0, 0]","[0, 0, 0, 0, 0]",14,non-hateful
tieba,race,挺烦的，一直就想封了那个傻逼，ww什么的,1,"[0, 1]",1,"[1, 0]",0,"[0, 0, 0]","[0, 0, 0, 0, 0]",20,hateful
zhihu,region,凭啥把锅甩给北京？,1,"[0, 1]",2,"[0, 1]",3,"[0, 0, 1]","[0, 1, 0, 0, 0]",9,hateful
tieba,race,为什么会被歧视？我觉得尊重是互相的，我不歧视任何群体，我是鄙夷某些行为。,1,"[0, 1]",2,"[0, 1]",3,"[0, 0, 1]","[0, 0, 0, 1, 0]",36,hateful
zhihu,race,估计不远了🤔,0,"[1, 0]",0,"[0, 0]",0,"[0, 0, 0]","[0, 0, 0, 0, 0]",9,non-hateful
zhihu,race,艾滋这事儿真的是国内最失败的一次舆论败仗，在早期大家从老港片以及一些西方影片中了解到艾滋，并且知道了艾滋的可怕。后来一通骚操作，现在的年轻人除了深刻的不能歧视艾滋病患者的思维以外，反而许多人却表达出一种对艾滋没有一丝恐惧的情绪，甚至在B站还能看到不断的复制黏贴什么艾滋长期服药传染低寿命长对艾滋的可怕程度不断弱化的言论，我想说你们关注过艾滋病患者的心理负担和对生命社交的绝望吗？不可怕的吗？然后就是取消入境检测。从来不说非洲人这病得病率。这几乎就是性教育的一次倒退，在政治正确和圣母的挟持下的倒退。,1,"[0, 1]",2,"[0, 1]",2,"[0, 1, 0]","[0, 0, 1, 1, 1]",249,hateful
